Movie_Name,Storyline
916. Jyukinshi,"Driving out some of the vilest, meanest ghosts and demons is Igami's bread and butter. But when he's up against the girl next door, it's like nothing he's ever seen before."
917. Back Doored (part 1),
918. Apo Hapon,"With the help of a historian eager to write his first book, a Japanese vlogger travels to the Cordillera region to discover the truth about her great grandfather-a soldier who deserted the Japanese Imperial Army during World War II and lived the next half-century among the Igorot people."
919. Traces of Responsibility,"In the 1994 Genocide Against the Tutsi in Rwanda, almost one million people were killed within 100 days. Mostly massacred with machetes. Incited by war propaganda from politicians and the media. In this road movie with interactive junctions, we embark on a journey through the Rwanda of today following the footsteps of a former minister and convicted war criminal who studied in Switzerland. The Investigative research is driven by the questions: What is he responsible for? What significance does his education in Switzerland have in relation to what happened in Rwanda? How does the next generation deal with these crimes? At sites where atrocities are commemorated today, survivors of the 1994 genocide against the Tutsi tell their stories. They show how perpetrators and victims found a way to continue living together in the same country. The interaction allows the audience to decide for themselves, based on different story lines, how intensively they want to deal with the horror and the universal questions of guilt and responsibility."
920. A Long Way from Heaven,"The Honor Code at Brigham Young University prohibits any expression of same-sex romantic feelings. To take a stand against this, students organize a demonstration to light the school's 300-foot 'Y' symbol in rainbow colors."
921. Boo Main Dargi,"In this movie, there is a boy who loves a girl but the girl's father says that you should have this much money and then he finds a treasure in an old mansion and the girl's father agrees."
922. The Snatcher,"A down-on-his-luck actor, a cunning con artist, a thrill-seeking adrenaline junkie, and a woman with a mysterious past, are brought together by a series of fateful events during a vacation in Thailand."
923. The Tattoo,"Meak and Kolney were in a romantic relationship, and Meak had Kolney's face tattooed on his chest as a sign of his love. Meak owned a tattoo shop where he met MeiMei, a woman who enjoyed getting tattoos. Kolney found out that Meak had been unfaithful with MeiMei and was deeply hurt. She ran away, and Meak later discovered that the tattoo of Kolney's name on his chest seemed to change, showing a smiling face at times and appearing frightening at others. Despite his efforts, he couldn't remove the tattoo. Tragically, Meak learned that Kolney had died while fleeing from him. He sought forgiveness, but it was clear that things could not be mended."
924. Broken,"In a vibrant, futuristic city where technology and nature coexist, a diverse group of high school misfits discovers an ancient map leading to a legendary hidden realm known as Elysium. Driven by a desire for adventure and a quest to escape their mundane lives. As they navigate challenges, unlock clues, and face quirky rivals, the group learns about friendship, self-acceptance, and the power of believing in themselves. Along the way, they confront their fears and insecurities, ultimately discovering that true treasure lies not just in the destination, but in the bonds they form along the journey. With a perfect blend of humor, heart, and stunning visuals, ""Broken"" captures the spirit of youth and adventure, inspiring viewers to embrace their individuality and chase their dreams."
925. Tilottoma,"Shyamapad Malakar is owner of an orphanage named Tilottama. There is another claimant of that land. So, the case is going on in the court. After 15 yrs, the case has not been resolved. The opposing party does not set foot in court for 3yr."
926. Blurred Lines,"Teenager Kinsley and her 6 friends go on a weekend camping trip; But when only 5 of her friends return with her, Kinsley finds herself with blood on her hands."
927. The Lonely Man with the Ghost Machine,"The final survivor of a global calamity faces the literal ghosts of his past, encroaching insanity, and a new threat lurking outside his door."
928. Molotov Cocktail,"The Molotov Cocktail is a comedy film set in the 1950s that tells the story of Parviz, who, in dire financial straits, wins a lottery ticket."
929. Azititoi,"An accidental discovery in an Athenian hospital reveals a personal and collective trauma about hundreds of patients who died from tuberculosis between 1945 and 1975 and were buried unnamed in mass graves on the hospital grounds. Eighty years later, their controversial story comes to light through their personal belongings and the search for living relatives."
930. Neve,
931. Bie ba zuo wen dang hui shi er,Xiaohua is a disruptive student who ignites a Chinese teacher's journey to reinvent himself.
932. Double Standards,Double Minded Man unstable in all his ways
933. Blue Imagine,"In the wake of a sexual assault, young actress Noel goes to Blue Imagine, a refuge for people who have experienced violence. With the help of her fellow residents, she is able to reclaim some of her confidence, and decides to confront her abuser."
934. Moartea lui Iosif Zagor,"With his old fashioned camera, the videographer Mr. Zagor (75 years) is documenting the last four years of his life while filming his loneliness and sickness."
935. Love and Friendship,"Three different segments set in the Philippines, depicted with conversations involving love of interests and friendships."
936. Hentai no kisetsu: Kôkotsu no ibuki,
937. Majnoo,"The film Majnoo is a Triangle Love Story of Majnoo, Preet and Mahi. Preet and Mahi fell in love with Majnoo and twists and turns come up when Mahi comes into the life of Preet and Majnoo. Who will become Majnoo's lover and partner."
"938. Imbroda, el legado del maestro","Biopic of Javier Imbroda, coach and teacher, who transformed people and cities. The story of an overwhelming personality who made everyone win. Imbroda made it possible to take his school team to the national elite, the creation of Unicaja, the Lithuanian revenge or the genesis of 'the family', the best Spanish team in history. The documentary questions the conception of superficial and fleeting success compared to the human and profound triumph that Javier Imbroda represented in all its facets."
939. Kereta,
940. More than a museum,"Through the story of the construction of the new Munch Museum in Oslo, carried out for over twelve years by a small Spanish architecture studio, estudioHerreros, we discover the astonishing transformation of the Norwegian capital."
941. Medway Queen: The Little Ship that Refused to Die,
942. Evor,"Dela, a woman whose life is ensnared within the confines of an unhealthy relationship, plagued by relentless abuse."
943. Una casa en el pueblo,"In this house you spent all the summers of your childhood. At the back of the courtyard, behind that door, it is said that a saint was born."
944. Layas,"In a poignant bid to break free from the confines of their impoverished provincial existence, five determined youths set out on a journey fueled by dreams of a better life. However, their aspirations are brutally shattered when they unwittingly fall prey to the sinister clutches of a ruthless child labor camp lurking within the bustling streets of Metro Manila. Exploited by a heartless syndicate, their innocence is ruthlessly exploited for profit."
945. Wounded Warriors,"A poignant exploration of one man's journey to break the violent chains of inter-generational trauma, set against the backdrop of a rural village in Central Province, Papua New Guinea."
946. Sariri,
947. Ill fated,"Elfreda, a freshman in the University of Lagos, has just moved into a new flat and is happy to finally be free from her overprotective parents. Not long after she has moved in, her next door neighbor's excessive noises prevent her from studies and quiet moments. After several complaints, Elfreda is left with no choice but to confront her neighbor directly. Femi is by far the most unusual person Elfreda has ever met. But somehow, something about him strikes her and she decides she wants to know more. As they both get close and begin to get fond of each other, Femi follows the advice of his therapist and reveals his mental conditions to Elfreda. Against her parent's wish, Elfreda continues what everyone else would consider a dangerous relationship, to which The Johnsons respond by using Tobi, the ex-boyfriend, to get Elfreda back to her senses. Femi's thoughts and dreams are constantly haunted, so much that loud music and writing are the only ways for him to drown the sounds of the torments. But the best remedy of all, is the presence of Elfreda that brings him some calm and peace. While this newfound relationship grows, it begins to put a strain to the supposed progress that Dr. Julia, the therapist, thinks they had been making, as Femi would no longer take medications, nor will he listen to her counseling. Even when Femi, finds the courage to tell Elfreda his compromising secret, an enchanted Elfreda still forgives and chooses to stay. While seeking to understand the nature if Femi's illness, Elfreda stumbles on a lead... Her lecturer at the university is involved in illegal research in which humans are used as lab rats and Femi just happens to be a victim, unknown to him. Until an unfortunate situation and the mysterious voices in Femi's head convince him to take his girlfriend's life. After uncovering his therapist's plot, Femi decides to get back at her for using him to make herself extra cash in illegal research projects."
948. Don't F with Pablo,"Pablo Escobar's illegitimate Jewish son in Miami, Pablito, Treks to Medellin to trace his ancestral roots and starts the kosher cartel."
949. Much to Tell,"Nathan transfers to a new school and meets Maxine, a girl who captures his heart. As their bond grows, he discovers her complicated past relationship, leaving him torn about pursuing his feelings."
950. 3 Karod 24 Khallak 1 Sawaal,"A reputed heart surgeon, Dr Devang Dholakia and his family members are held hostage at different locations. Why have they cornered the entire Dholakia Family? Will they come out of this unscathed?"
951. Her Life Choice,The personal story of one woman's struggle to question reproductive choice in the face of the loss of her life during post-World War America.
952. Eiga Oshiri Tantei Saraba Itoshiki Aibô (Oshiri) yo,
953. Pitik bulag,
954. Villa Malaga.,"After purchasing at an auction some old bottles of Malaga wine, surprisingly produced in a Swiss city at the beginning of the last century, Stefan begins a journey through history, time and space: from the winery in the city of Lenzburg where they were raised and bottled, to the city of Malaga in search of the origin of those mythical wines. A historical tasting that brings together friends and experts, takes us deeper into the lives of different characters who attend the meeting."
955. Un paese ci vuole,"Documentary that originated from the book Un paese by Cesare Zavattini and Paul Stand, published in 1955. Years later, we are shown the current situation of Luzzara and the Po River."
956. The Canfather,WHEN THE BEER WORLD MEETS THE MAFIA THE BATTLE OF BREWINGTON BEGINS
957. Mums Who Do Porn,"A look at the big business of older women in adult entertainment, a world where age doesn't matter and earning potential is huge"
958. Dawgs 4 Life,"A STORY ABOUT FOUR BEST FRIENDS WHO GREW UP ON THE SOUTHSIDE OF CHICAGO FACED WITH POVERTY, DRUGS, JEALOUSY, BETRAYAL AND MURDER. THEY REALIZE THAT ALL THAT THEY HAVE IS EACH OTHER, AND IN REALITY, THAT IS NOT EVEN TRUE. BOUND BY A PACT TO STAY LOYAL, TRUE AND DEDICATED TO ONE ANOTHER, MONEY BECOMES THE CAUSE OF A BLOODY SEPARATION."
959. Life and Other Problems,"What is the meaning of life, death and all the rest? Max Kestner gives an energetic and imaginative answer in his adventurous film, which begins with the killing of a young giraffe from Copenhagen."
960. Öldüm Bittim,"It deals with the events that develop after Mehmet, who is a diseased person, has the illusion that she has a week to live"
961. Haddhu Ledhu Raa,
962. 2475 Dawn of Revolution,This animation will bring you back in time to witness significant occasions that occurred during the Siam Revolution in 2475 BE (AD1932).
963. Brev til Håkon Banken,"Håkon Banken was a Norwegian artist, who sold thousands of cassettes and albums, with songs describing his own troubled life. He rarely did live shows or interviews, and struggled with anxiety and depression. This is his story."
964. Blue Ice,"4 Female Thieves Angaleec, Isabelle, Gloria, and Liyah set out to steal the largest diamond in the world, The South African Blue Diamond valued at $500 million which makes it The Largest Diamond heist of the century but it wasn't an easy task dirty cops, backstabbing, and betrayal mixed with greed created the recipe for mayhem and destruction."
965. Retrospect,"In Europe's oldest city, Plovdiv, Bulgaria an old man who used to spy on his neighbors for the secret police, continues to do it over 30 years later as a pastime. He becomes convinced that a British man who lives opposite him is responsible for the disappearance of a Couchsurfer. It further becomes complicated when the foreigner starts a relationship with his grandniece. As he tries to uncover the truth he also is confronted by the change in culture from one of people trying to keep their private lives secret, to one where people are sharing their every move publicly. Along the way, his complex past reveals itself."
966. The Paranormal UFO Connection,"Explores whether UFOs might be more than just physical spacecraft, looking at their possible spiritual, psychic, angelic, and even demonic elements."
967. La Snagov,
"968. The roller, the life, the fight",Hazem arrives in Belgium after a painful journey from Gaza. Elettra arrives in Brussels to study documentary film. Their first moments together trigger the desire to know each other and the camera becomes the tool they share for understanding. Exiles and inner migrations find a way to just and softened gazes.
969. Night of Nights,Chronicles the early days of the COVID pandemic and the following existential chaos and horror.
970. Doenjang-i,
971. Dink Legacy,"The final part in the Dink saga, can the evil death donkey Jared finally be defeated by Dink and his friends?"
972. AI: Artificial Influence,
973. El Carretón del Desierto,
974. Satham Indri Mutham Tha,"A woman is hit by a car and rescued by a stranger. Suffering amnesia, he takes her in while police search for the missing wife at her husband's behest. Will her memory return before the relentless inspector cracks the mystery?"
"975. Seishun jakku: Tomerareru ka, oretachi o 2",
976. The Claddagh,"Friendship, Loyalty, and Love converge when a lonely writer falls for a Colombian photographer while trying to save his family's Irish Pub from being sold."
977. Art of War,
978. Ghannu Bhai,
979. Kusum Ka Biyaah,"Sunil's marriage is finalised after many problems, all of the family members are overjoyed. However, on the day of the wedding, the entire country slips into complete lockdown owing to Corona."
980. Stand by me,
981. Blue Caveman,"A family of misfit artists investigate the mystery of their connection to one of Whitecreek, California's most whispered urban legends: The Church of St. Zombie Do Good."
982. 1957,
983. Hidden Feeling,
984. Culturegeist,"Riley James, a content creator, tries to uncover the mystery of several disappearances from 1995 and 2001, leading her down a rabbit hole that changes her life forever."
985. Campus Kings,
986. Love Square,
987. Forever Queens,"Three senior women rehearse for a NYC beauty pageant in this poignant documentary exploring beauty, aging and loneliness."
988. Imperfect Match,
989. Drzewo milosierdzia,"An island, a tree and a woman. Gestures that are repeated day after day with subtle variations. Until something sinister and prophetic, an echo of the outside world, breaks into this everyday life changing the course of things."
990. Moses,"In San Francisco, a man enduring homelessness for two decades connects with passersby to be seen among the invisible, a skill he learned from a promising music career cut short in the 70s, and one that will ultimately transform his life."
991. Until I Fly,"A charismatic Indian-Nepali boy, lives a bohemian life in a remote Himalayan village. As he transitions from childhood to teenagehood, his poetic journey of perseverance echoes issues that span across ages and communities."
992. Beyond Limits,"Daisy, a house wife is maltreated by her husband. Her brother in-law is against the way her husband treat her and on several occasions defends her. The Story changes when they both fall in love."
993. Alli Eid Dinner,
994. A Threnody (One of Many...),"Due to a personal loss, two friends must learn to live with an empty space left in their lives. Meanwhile, a curious raccoon spends its time on earth by pondering some of life's biggest questions - and playing a bit of boomerang as well."
"995. Feld, Acker, Wiese - Freiflächen der Nordschweiz",
996. Wiltshire,"In small town Wiltshire, gossip flows and reputations proceed. When Jason (Ethan Spence) enters the picture, he seems to be the only to one to notice the eerie aura that the other citizens seem to thrive in."
997. Following the Footsteps,Andrew Chalmers joins Bob and Pam Rognlien as they lead a small group of pilgrims in the historical footsteps of Jesus.
998. Löwenzahnkind,Dandelion Children are children of addicted parents. Jasmin and other affected people tell their story and talk about the challenges and prejudices they and over 100'000 other dandelion children in Switzerland are confronted with.
999. Root: Korean American Saga,". As the 20th century unfolded, the first wave of Korean immigrants, known as ""Issei,"" began to arrive in the United States, predominantly settling in regions such as Hawaii and California."
1000. Ghost Girl Gone Global: How Sadako Terrorized Tinseltown,A documentary made about the transition of the RING horror film franchise from Japan to America. The documentary was produced for the Shout. Factory box set comprising new 4k editions of the three American RING films.
1001. Artefacto 71,"One thing is clear: The contemporary artist can dispense with his manual skills and give as much or more importance to intellectual work than to the artistic object. So, what does an artist do?"
1002. 2 Steps Forward,"""Davis, dealing with a loss of a loved one confides in his close friend Eric which leads to the question if God abandons people"""
1003. Vacation Time,
1004. Chasing the Dead Requiem,"A young woman and two American veterans searching for the abandoned dead find more than they bargained for. Directed by Tom Philips (Moonshiners, Forged in Fire, David Attenborough Meets President Obama, MonsterQuest)"
1005. White Muscle Daddy,"Soon after Jeremy clocks in for his first graveyard gym shift, he meets Eugene, a fitness influencer who seems to have the life Jeremy dreams of. What begins as an envious crush quickly morphs into an insatiable and destructive hunger."
1006. Sweet Stitch,
1007. Daroga Mamur Kirti,In North Bengal there was a village where crime rate was very high. That time lakhi Daroga posted their as a police man. And his nephew Ayan. Ayan was a brat. But after meeting with Labanya he became change into a different man.
1008. Illuminate - Monica Vitti - La donna che visse due volte,The Italian actress Carla Signoris falls asleep and find herself living the day when French newspaper LE Monde announced Monica Vitti's death...making a big mistake
1009. Her Dark Past,"Tosin, a life coach and a social media influencer with the picture perfect life, years ago had a child from her stepfather whom she murdered. Whilst still suffering from this traumatic event, she takes antidepressant pills to suppress the taunting memory. Afraid to lose this new world built on lies, she does everything within her power to conceal it until she is threatened by the secret of her son, Emmanuel being alive. Soon he begins to live with her based on the lie she conceived of him being her nephew from her estranged sister, and without doubt her husband and daughter welcomes him wholeheartedly. With Tosin's unwillingness to show affection and her nonchalant nature towards him, he runs away to an unknown location. After several searches for him by the entire family, her world comes crashing when gossip blogs releases information about her being a fake who changed her identity and a murderer alongside news that Emmanuel is her son and not her nephew. In the midst of all this, she gets to know that the person behind the leaked information was none other than her personal assistant who is also her stepbrother. What will happen to her marriage and career After this? Will she be pardon for the crime or prosecuted? What about her personal assistant who betrayed him?"
1010. It'll Never Work,"A small film, but a powerful one. It's a real story, a drama, a documentary, a thriller, a comedy, a snatch of real life, a tragedy, a feel-good story and an environmental statement all set in the West Coast of Scotland's fishing industry."
1011. A Trip to the Village,
1012. Maantrika,GHOST HUNTER Brilliant Director of Indian Cinema going to rule in Coming Days.
1013. Hate Songs,Two actors and a technician are gathered at the former Rwandan propaganda radio station to rehearse a program that conveys ideas of pacification and hope. But first they will have to overcome the terrible past that unites them.
1014. Inside Tibet,"For around fifteen years, no Western camera has been able to get to the heart of Tibet. In this revelatory doc, Jean-Michel Carré gains authorisation over several months to film the human, economic and political realities of the region."
1015. Hágase tu voluntad,"A father who seeks euthanasia after two strokes attempts to reconnect with his estranged sons before his death. His journey reveals family bonds, forgiveness, and life choices through both humorous and poignant moments."
1016. Nonm,
1017. The Killing Performance,"A famous actress were killed by a secret gun. On the night of the first seventh day, private detective Man and suspects were kidnapped in a theater. The mysterious masked killer, known as the ""madman,"" surrounded them with his subordinates and forced detective Man to find out the true culprit within four hours. Otherwise, everyone on the scene would be killed and the souls of the beautiful women would be sacrificed. Countdown starts. Everyone had secrets, everyone was acting, fighting against gods and immortals, searching for criminals in secret rooms. There was a hidden answer in the answer, which was reversed and then reversed again, causing a thrilling burst of laughter and layers of lies, gradually uncovering the truth."
1018. Send Kelp!,"Frances Ward, a self-professed ""Seaweed Nerd"" and adventurer, is about to give up everything she's built in her life to start a kelp farm off the west coast of Canada. SEND KELP. follows Frances on an odyssey that brings her into the vast oceans of the Pacific where she intends to build one of the first farms of its kind in British Columbia. But to coax a crop from the wild Pacific, she'll need help from scientists, wild harvesters, and entrepreneurs who know the challenges and astonishing potential of this miraculous organism. And along the way, she'll find a glimmer of the hope that seaweed might provide not only for our planet, but for her, too."
1019. The Cult,"A new regime overthrows the US government after economic collapse, forcing people into farm labor. A cult abducts families, brainwashing them for power. Captives and gang members fight to decide the nation's fate."
1020. The Thing About Men,She's a lawyer in one of the top law firms in town. He's the son of the owner. Their relationship starts off rocky and animosity and slowly evolves into a romantic situation
1021. Amelia,"Mourning the loss of her unexpectedly passed father, Amelia struggles with their estranged relationship, while navigating her detached empathy and unanswered questions."
1022. Dead of Night,A young lady living in a small backwater town joins her friends to rob an abandoned house. They end up unleashing their worst nightmare when they discover that the house is not empty and not everyone in it is human.
1023. Bigul,"Delves into religious fanaticism, unchecked ambitions, and community resilience. As mysterious murders grip a tranquil village, haunting echoes of Bigul serve as reminders of the terror unfolding on the road to the Goddess temple."
1024. A Glimpse of Forever,
1025. Condemned,"In this award winning* B movie, type A personality Bar Gold starts losing grip on reality, as his loving, yet mentally ill wife, Angela, insists on taking up the reigns of his music business; as they clash, their teenage son Roland ventures into crime, with dire consequences. Things, however, are not as they seem. *""Best Canadian Director"" and ""Best Male Director"" for Bas Majzoub @ HORROR FILM AWARDS in London, England *""Best Actress"" for Suzanne Miller @ ALTERNATIVE FILM FESTIVAL in Toronto, Canada. *""Best Director"" for Bas Majzoub, ""Best Actress"" for Suzanne Miller, and ""Best Actor"" Chase Anthony @ STOCKHOLM CITY FILM FESTIVAL, in Stockholm, Sweden."
