Movie_Name,Storyline
1. The Fall Guy,"A stuntman, fresh off an almost career-ending accident, has to track down a missing movie star, solve a conspiracy and try to win back the love of his life while still doing his day job."
2. Ghostbusters: Frozen Empire,"When the discovery of an ancient artifact unleashes an evil force, Ghostbusters new and old must join forces to protect their home and save the world from a second ice age."
3. Civil War,"In a dystopian future, four journalists travel across the United States during a nation-wide conflict. While trying to survive, they aim to reach the White House to interview the president before he is overthrown."
4. Sleeping Dogs,"An ex-homicide detective with memory loss is forced to solve a brutal murder, only to uncover chilling secrets from his forgotten past."
5. Road House,"Ex-UFC fighter Dalton takes a job as a bouncer at a Florida Keys roadhouse, only to discover that this paradise is not all it seems."
6. The Idea of You,"Solène, a 40-year-old single mom, begins an unexpected romance with 24-year-old Hayes Campbell, the lead singer of August Moon, the hottest boy band on the planet."
7. Damsel,"A dutiful damsel agrees to marry a handsome prince, only to find the royal family has recruited her as a sacrifice to repay an ancient debt."
8. Godzilla x Kong: The New Empire,"Two ancient titans, Godzilla and Kong, clash in an epic battle as humans unravel their intertwined origins and connection to Skull Island's mysteries."
9. Kung Fu Panda 4,"After Po is tapped to become the Spiritual Leader of the Valley of Peace, he needs to find and train a new Dragon Warrior, while a wicked sorceress plans to re-summon all the master villains whom Po has vanquished to the spirit realm."
10. Snack Shack,"Nebraska City, 1991, two best friends get the chance to run the swimming pool snack shack, that later comes to be the perfect scenario for transgression, fun, personal discovery and romance."
11. Oddity,A psychic medium attempts to uncover the truth behind her sister's murder at the site of the crime.
12. Scoop,"An insider account of how BBC Newsnight obtained the bombshell interview with Prince Andrew about his friendship with convicted sex offender, Jeffrey Epstein."
13. Rats!,"In Fresno, Texas, graffiti artist Raphael's arrest leads to his involvement in a chain of events involving a sting operation, suicide, drug deals, criminal suspicions, weapons, a newswoman, and a plutonium deal gone wrong, creating chaos."
14. Immaculate,"Cecilia, a woman of devout faith, is warmly welcomed to the picture-perfect Italian countryside where she is offered a new role at an illustrious convent. But it becomes clear to Cecilia that her new home harbors dark and horrifying secrets."
15. Ricky Stanicky,"When three childhood best friends pull a prank that goes wrong, they invent the imaginary Ricky Stanicky to get them out of trouble. Twenty years later, they still use the nonexistent Ricky as a handy alibi for their immature behavior."
16. Monkey Man,An anonymous young man unleashes a campaign of vengeance against the corrupt leaders who murdered his mother and continue to systematically victimize the poor and powerless.
17. Sew Torn,"A seamstress gets tangled in her own thread after stealing a briefcase from a drug deal gone bad. In an escalating game of cat and mouse, her different choices lead to drastically different outcomes along the way."
18. Arcadian,A father and his twin teenage sons fight to survive in a remote farmhouse at the end of the world.
19. Absolution,"An aging gangster attempts to reconnect with his children and rectify the mistakes in his past, but the criminal underworld won't loosen their grip willingly."
20. I Wish You All the Best,"After being kicked out of the house by their parents, a teen embarks upon a journey of self-discovery that teaches them about love, friendship, and family."
21. A Nice Indian Boy,"When Naveen brings his fiancé Jay home to meet his traditional Indian family, they must contend with accepting his white-orphan-artist boyfriend and helping them plan the Indian wedding of their dreams."
22. Y2K,Two high-school nobodies make the decision to crash a Y2K party. The night becomes even crazier than they could have ever dreamed when the clock strikes midnight.
23. Bob Trevino Likes It,"When lonely 20-something Lily Trevino accidentally befriends a stranger online who shares the same name as her own self-centered father, encouragement and support from this new Bob Trevino could change her life."
24. The Wonderful Story of Henry Sugar and Three More,Four tales unfold in writer-director Wes Anderson's anthology of short films adapted from Roald Dahl's beloved stories.
25. Secret Mall Apartment,"In 2003, eight Rhode Islanders created a secret apartment inside a busy mall and lived there for four years, filming everything along the way. Far more than a prank, the secret apartment became a deeply meaningful place for all involved."
26. Irish Wish,"When the love of Maddie's life gets engaged to her best friend, she puts her feelings aside to be a bridesmaid at their wedding in Ireland."
27. The Greatest Hits,"A love story centering on the connection between music and memory and how they transport us, sometimes literally."
28. The Goat Life,"An Indian man seeking work follows a job lead to Saudi Arabia, only to find himself forced to labor without pay as a goat herder in the remote desert."
29. My Dead Friend Zoe,"Engaged in a mysterious relationship with her dead best friend from the Army, a female Afghanistan veteran comes head to head with her Vietnam vet grandfather at the family's ancestral lake house."
30. Dead Mail,"An ominous help note finds its way to a 1980s post office, connecting a dead letter investigator to a kidnapped keyboard technician."
31. Winnie-the-Pooh: Blood and Honey 2,"Not wanting to live in the shadows any longer, Winnie-the-Pooh, Piglet, Owl, and Tigger take their fight to the town of Ashdown, leaving a bloody trail of death and mayhem in their wake."
32. Diane Warren: Relentless,"The untold story of a legendary songwriter. Featuring Cher, Common, Jennifer Hudson, Gloria Estefan, Kesha, LeAnn Rimes, and more."
33. 18×2 Beyond Youthful Days,"Jimmy grows close to Ami, a Japanese backpacker, during one summer, then she leaves suddenly. Years later, a postcard draws him to Japan to face his first love and reflect on who he has become."
34. Babes,"Lifelong friends Eden and Dawn, one single and wanting a baby, the other already a mother, navigate challenges to their bond when Eden pursues pregnancy alone after a one-night stand."
35. Cabrini,"After witnessing disease and poverty in the slums of New York, Italian immigrant Francesca Cabrini embarks on a daring journey to persuade the hostile mayor to provide housing and healthcare for hundreds of orphaned children."
36. Rita,"A new wife Rita, who finds herself alone when husband Ariel works abroad. They both find sexual satisfaction in other people. When Ariel comes back, they both act like nothing happened. But will this keep their marriage from falling apart?"
37. Madgaon Express,The journey of three childhood friends who embark on a trip to Goa that goes completely off-track.
38. Anaconda,"A re-interpretation of the iconic '90s creature feature, in which a group of circus athletes - having found themselves stranded in a rain forest - come face-to-face with the elements, a bloodthirsty poacher, and a formidable giant snake."
39. Magpie,A couple find their lives turned upside-down when their daughter is cast alongside a controversial major star.
40. Things Will Be Different,"In order to escape police after a robbery, two estranged siblings lie low in a farmhouse that hides them away in a different time. There they reckon with a mysterious force that pushes their familial bonds to unnatural breaking points."
41. The Invisibles,"A couple facing the end of marriage, when the husband starts to disappear. As he fades from existence he discovers a new world of people who have disappeared just like him."
42. High Tide,"Heartbroken and adrift, undocumented Brazilian immigrant Lourenço searches for purpose in the queer mecca of Provincetown. As the summer season comes to a fade, he sparks an intense and unexpected romance with Maurice. Together, the two reconcile the pasts they've left behind and their uncertain futures."
43. Billy Preston: That's the Way God Planned It,Follows the story and challenging life of legendary musician and genius keyboardist Billy Preston.
44. Omni Loop,"A woman from Miami, Florida decides to solve time travel in order to go back and be the person she always intended to."
45. Something in the Water,A group of five friends must fight for their lives in open water after a dream wedding turns into a nightmare.
46. Chantal in Fairyland,"Chantal will be involuntarily transported to a fairy tale world, fighting against witches and tyrant kings, but above all for her friendship with Zeynep."
47. The Beautiful Game,Advocates to end homelessness organize an annual tournament for homeless men to compete in a series of football matches known as The Homeless World Cup.
48. I Don't Understand You,"Stranded in rural Italy without transportation or language skills, an American couple on the verge of adopting tries to reconnect during a disastrous vacation, as their fears and relationship problems threaten to boil over."
49. Graduate with First Class,"Amit navigates love amidst Maya's influence and Niharika's genuine affection, facing choices that shape his fate, unraveling a tale of redemption and tragedy."
50. Shaitaan,"A family's getaway turns terrifying when an intruder possesses the teen daughter's body, putting her at the mercy of his increasingly sinister commands."
51. Timestalker,The hapless heroine Agnes is reincarnated every time she makes the same mistake: falling in love with the wrong man.
52. Mom,"Struggling with postnatal depression and feeling misunderstood by her husband, Meredith begins to experience terrifying visions foreshadowing an ultimate tragedy."
53. Kryptic,"A woman searches for a missing monster hunter, realizing she has an inextricable bond with the creature being pursued."
54. The Uninvited,"A stranger crashes a party, sparking a comedy of errors, and a reordering of life."
55. The Severed Sun,"Magpie lives in an isolated church community ruled over by her father, The Pastor. When a man is murdered, paranoia sets in and people start to whisper about a strange 'Beast' that lives in the forest."
56. Tillu Square,"One year after a love affair entangled him in a murder case, a hapless DJ has a one-night stand that leads to even messier kerfuffles tied to his past."
57. Por,"Journey that delves deep into the complexities of friendship. Set against the backdrop of a vibrant college festival, the movie explores the intricate dynamics between two friends whose paths diverge and ignite a fierce competition."
58. I Love You Forever,A subversive romantic comedy gone wrong that follows a young woman into and out of an emotionally abusive relationship.
59. A World Apart,"Michele relocates from capital to remote village Rupe in Abruzzo park. Challenges emerge as she aims to keep local school with few students open, set against idyllic winter and summer backdrops."
60. Megamind vs. The Doom Syndicate,"Megamind's former villain team, The Doom Syndicate, has returned. Newly crowned hero Megamind's must now keep up evil appearances until he can assemble his friends to stop his former evil teammates from launching Metro City to the Moon."
61. Shirley,Shirley Chisholm makes a trailblazing run for the 1972 Democratic presidential nomination after becoming the first Black woman elected to Congress.
62. 5lbs of Pressure,"Trying to start over, Adam searches for redemption as he returns to his old neighborhood to put to rest his demons while the brother of the man he killed seeks revenge."
63. Yodha,"After terrorists hijack a passenger plane, an off-duty soldier aboard devises a strategy to defeat the hijackers and ensure the passengers' survival when the engine fails."
64. Sugar Baby,"An enterprising Sugar Baby is offered $30,000 to move in with her Sugar Daddy for the week, but soon discovers the sinister secrets trapped within his home."
65. Dandelion,"It follows a singer-songwriter in a downward spiral as she takes a last effort gig at a motorcycle rally in South Dakota where she meets Casey, a guitarist who walked away from his dream long ago."
66. We Were Dangerous,"Nellie, Daisy and Lou attend an institution for delinquent girls on an isolated island in 1954. The trio rail against the system, finding strength in their friendship but this is challenged when the school's matron divides them."
67. Fly,"Over seven years, three couples involved in the extreme sport of BASE jumping test the limits of love and life itself. Risking everything for the thrill of the jump, their dedication is put to the ultimate test."
68. The Fall,"A brash, amateur photographer, reeling from her mother's suicide, must rectify her self-destruction and accept the past in order to receive love and redemption."
69. Tim Travers & the Time Travelers Paradox,What happens if you travel back in time and eliminate your younger self? Terminally bored mad genius Tim Travers seeks to find the answer and unravel the time traveler's paradox. The Result? A crazy comedic adventure beyond comprehension.
70. Cash Out,"Professional thief Mason attempts his biggest heist with his brother, robbing a bank. When it goes wrong, they're trapped inside surrounded by law enforcement. Tension rises as Mason negotiates with his ex-lover, the lead negotiator."
71. Just in Time,"A couple struggling to conceive receives an antique watch from a stranger, leading the wife to realize that the answers she seeks will come in due time."
"72. My Wife, My Abuser: The Secret Footage","Exposes the disturbing story of Richard Spencer's harrowing experience as he endured two decades of abuse at the hands of his wife, Sheree Spencer."
73. Kalikot,"Sal, a professor, moves near an auto shop. Arnel, a repairman, is attracted to her after she brings her car for repair. Their relationship develops, but they face challenges navigating it while Arnel works at the shop."
74. Outlaw Posse,"In 1908, an outlaw returns from years of hiding in Mexico to claim stolen gold hidden in the hills of Montana."
75. Billy & Molly: An Otter Love Story,A man forms an unlikely friendship with a wild otter while living in the remote Shetland Islands
76. We Strangers,"We Strangers is an addictive and haunting study of race, class and assimilation, centering around Ray, a charming and self-determined woman living in Gary, Indiana."
77. Fasal,A farmer's story highlighting the challenges and hardships he faces while navigating the market value of his crops.
78. Gunfighter Paradise,"A hunter brings home a strange green case to North Carolina. After his mother dies, he returns to the family house where his sanity crumbles. Haunted by voices, visions, cryptic notes, and odd visitors, he spirals deeper into madness."
79. Bhoothaddam Bhaskar Narayana,"In a small town in southern India, a rash of unsolved murders over the past 18 years has left the region shrouded in mystery. Despite repeated efforts, local police have failed to find any explanation or suspect."
80. My First Film,"Follow a young filmmaker, as she recounts the story of struggling to make her first feature. Fact bleeding into fiction, and past, present, and future converging to create a modern myth that redefines the very act of creation."
81. Desert Road,A woman crashes her car and walks down the road for help - only to find no matter which way she walks she ends up back at her crashed car again.
82. Hot Spot,It features three stories that are humorously evocative and a fourth one that's deeply disturbing.
83. Brandy Hellville & the Cult of Fast Fashion,The Instagram-perfect image of Brandy Melville hides a toxic culture endemic to fast fashion.
84. You Shouldn't Have Let Me In,"During a bachelorette party in Italy, a group of girls invite a handsome stranger into their home, not realizing he's a vampire looking for a bride."
85. Brian Simpson: Live from the Mothership,"From embracing his inner hater to the rigid rules of masculinity, the comic Brian Simpson goes full throttle during his stand-up routine live from The Comedy Mothership, in Austin, Texas."
"86. I Am the River, the River Is Me","Māori tribal leader Ned Tapa takes a group of friends and family on a canoe trip down the Whanganui River in Aotearoa/New Zealand, the first river in the world recognized as a legal person."
87. Eks,Three compelling stories in one erotic experience. Yen Durano plays three different women in three titillating stories.
88. The Thundermans Return,"It centers on the family as they begin a new era of superhero crimefighting. When one save goes wrong, the Thundermans are sent back to Hiddenville."
89. Crew,Follows three hard-working women as their destinies lead to some unwarranted situations and they end up caught in a web of lies.
90. TL,"Brenda, a top agent in a BPO company, is always overlooked for promotion. But not this time; as she gets more than intimate with her TL. Is her long awaited position within her reach? Or did she just put herself in a bad situation?"
91. Prey,A young couple is compelled to leave their Christian missionary station in the Kalahari Desert after being threatened with death by an extremist militant gang. After crashing their aircraft they must battle man and beast for their lives.
92. The Wages of Fear,"In order to prevent a deadly explosion, an illicit crack team has 24 hours to drive two truckloads of nitroglycerine across a desert laden with danger."
93. Dragonkeeper,"The fate of ancient China rests on the shoulders of one young girl, who must find the last remaining dragon egg and fulfill her destiny."
94. Sentinel,"Years after an alien invasion, three heroes decide to time travel to save the survivors but they don't know that the Sentinel is waiting for them."
95. Doraemon the Movie: Nobita's Earth Symphony,"Doraemon and friends go on an adventure to meet new buddies, connect to people with music, and save the world from a crisis."
96. Operation Valentine,"Showcasing the indomitable spirits of the Indian Air Force heroes on the frontlines and the challenges they face during one of the biggest, fiercest aerial attacks that India has ever seen."
97. Finding Faith,"Victoria, a Christian advice columnist writing under the name Faith, begins to lose her faith after a series of life events. On her journey back to God, she also finds her way back to love."
98. Murder Mubarak,"During a murder investigation, a non-traditional police officer turns a spotlight on an array of suspects. He steps into their world as an outsider, only to find there is so much more than what meets the eye."
99. Checkmates,"After a traumatic divorce, Candela loses her job at an elite school. So she has to return to the neighborhood she left and ask for help from her sister and father, and teach at her old high school to students with integration problems."
100. Plan B,"When a one night stand with her awkward neighbor leaves her pregnant, a young woman decides to quickly sleep with a successful businessman and tell him he's the father of her unborn baby."
101. Doin' It,An Indian-American virgin gets a job teaching high school sex ed.
102. Heaven is Beneath Mother's Feet,"Adil, mentally 8-year-old, lives with elderly mother Raikhan. Believing pilgrimage to Mecca on foot ensures Raikhan's heaven entry, Adil travels across Kazakh steppe facing obstacles. Mother-son journey's hardships depicted."
103. Just a Farmer,"A newly widowed mother is left with the care of an alcoholic father-in-law and a failing farm. She is forced to forge a new path for her family, all while struggling to pick up the pieces of her life."
104. Música,"A coming-of-age love story that follows an aspiring creator with synesthesia, who must come to terms with an uncertain future, while navigating the pressures of love, family, and his Brazilian culture in Newark, New Jersey."
105. Another Day in America,"Based on true events: 'Another Day in America' is a dark, radical comedy-drama that revolves around an ensemble of distinct characters as they each go through a post-pandemic day in an American office."
106. The Lost Daughter,"A young woman follows a mysterious melody onto a remote tidal island. When she crosses back over at the next low tide, she emerges into a world where 25 years have passed."
107. Art of Love,"After learning that the art thief she has been chasing is her ex-lover, an officer working for Interpol concocts a plan to catch him red-handed."
108. The Gutter,"Walt lands work at bowling alley AlleyCatz. He's pressured to embrace his bowling talent, which sparks backlash from detractors seeking to undermine his sudden pro success."
109. 7 Keys,"Daniel has kept the keys to the places he's lived in. Lena wants to use them - on the ultimate tour of London, a weekend of getting to know each other intimately in other people's homes. This risky fantasy soon becomes a deadly threat."
110. Mamífera,"Lola's unplanned pregnancy disrupts her life plans. She resists motherhood while Bruno wants to be a father, forcing her to confront her fears and societal expectations as she seeks clarity on her future."
111. Little Wing,A 13-year-old girl is dragged into the world of pigeon racing as she deals with her parents' divorce and the impending loss of her home.
112. Fluxx,Trapped in a surreal Hollywood Hills mansion a tormented actress must piece together memories and escape a nightmarish reality before losing her grip on sanity-and the truth about her husband's fate.
113. My Name Is Loh Kiwan,"After defecting from North Korea, Loh Kiwan struggles to obtain refugee status in Belgium, where he encounters a dejected woman who has lost all hope."
114. Cold Wallet,"A team of Redditors lose everything after a cryptocurrency scam leads them to plot to kidnap the ""financial influencer"" who screwed them over."
115. Now or Never!,"On March 15, 1848, a young firebrand poet, Sándor Petöfi ignites the Hungarian Revolution with his passionate 'National Song', prompting the Austrians to dispatch a ruthless secret agent to assassinate him and suppress the uprising."
116. A Strange House,"Amemiya is an unpopular Youtuber who specializes in the occult. One day, his manager brings him a floor plan with an inscrutable point. With the help of Kurihara and Yuzuki, he begins to look into the plan and reveal the mystery behind."
117. Monster Mash,"Dracula, the Werewolf, the Mummy and the Invisible Man must work together to stop Dr. Frankenstein from creating an unstoppable monster."
118. Heart of the Hunter,A retired assassin is pulled back into action when his friend uncovers a dangerous conspiracy at the heart of the South African government.
119. Grand Theft Hamlet,"Two struggling actors find solace from lockdown isolation by staging Hamlet in Grand Theft Auto Online (2013), battling griefers as they connect through William Shakespeare."
120. Kuyang,"A candidate of civilian servant named Bimo was assigned to an isolated village in Borneo island and brought his wife, Sriatun, who was pregnant. Strange events began to occur since their arrival in the village."
121. Stormy,Behind the curtain with Stormy Daniels as she shares her story. The film follows her reinventing herself while grappling with events from 5 years earlier that made her an unlikely American icon.
122. We Shall Not Be Moved,"Socorro, obsessed with finding her brother's killer from 1968's Tlatelolco massacre, receives a clue and risks everything, straining family ties, to avenge his death by locating the former soldier."
123. We're All Gonna Die,"In near future, everyone's gotten used to the 10, 000-mile alien tentacle that materialized in the sky, and a struggling beekeeper and a grieving wanderer must join together and take a dangerous roadtrip to get their teleported stuff back."
124. Blink,"Apoorva hides his failed MA from his mother in Bengaluru. Working odd jobs and relying on Swapna, his ability to control blinking becomes a curse when an old man says his father lives."
125. Christspiracy,"The moral dimension of humanity's interaction with nonhuman animals and the industries that profit from their exploitation, as informed by world religions. A historical explanation of how the current global situation came to be."
126. Peter Five Eight,A seemingly glamorous real estate agent in a small mountain community is revealed to be an unhinged alcoholic with a dark secret when a charismatic man in black shows up one day at the behest of his shadowy boss.
127. Kapalit,"Audrey is hired as a private nurse by Stan for his sick wife, Demi. But as Audrey spends time with the married couple, she falls for Stan and works her way to replace Demi as Stan's lover."
128. Agathokakological,"Nisha gets frequent blackmail calls from a Pvt number and she ignores it. Initially, it looks like a blackmail attempt, but things take a different turn as Nisha gets into trouble regularly. SI Ajith, has to figure out who's behind this."
129. ZEF: The Story of Die Antwoord,"The story of the controversial South African band Die Antwoord. Tracing them from their humble beginnings to global phenomenon. Like their music the documentary is shocking, provocative, highly creative and strangely funny."
130. The Ballad of Davy Crockett,"In 1815, an American Legend, whose wife has fallen deathly ill, leaving his young children to survive on their own, must fight his way back to them across the many perils found in the Savage Lands of the wild frontier."
