Movie_Name,Storyline
"490. Us, Our Pets and the War",The film highlights the stories of people and their pets against the backdrop of the Russian invasion of Ukraine in 2022.
491. Hope of Escape,A mother and daughter must plan their escape from enslavement after learning they are about to be sold and separated forever.
492. Good Guys Go to Heaven,"Dan dies in a car accident. He arrives in Paradise and finds out that he is not alone in this place: Laura, the girl he was in love with in high school, is also here. Will the two finally manage to be together?"
493. Bionico's Bachata,Romantic Bionico struggles to find a job and home to provide for fiancée La Flaca after rehab. He tries to quit drugs with help from his partner Calvita.
494. Inti Number 13,An old man and a writer discover supernatural things happening in a villa. Can they find a solution to get rid of the situation?
495. The SML YTP Movie 2: Dimension Trouble,"Dr. Dimension wants to suck every SML Universe into the death dimension. Now, our hero, Jeffy, having finally returned home from his cross-dimension journey, unites the plushes and human puppets to save the multiverse from the forces of Nintendo before it's too late."
496. Don't Ever Stop,"De Vit kept the 90s generation dancing despite the AIDS epidemic through interviews and his words, a moving tale of beats, living, ecstasy and his continuing legacy."
497. No estás loca,
498. Pol Pot Dancing,"A star dancer at the Cambodian royal court lovingly raises her husband's little brother as her own son. Decades later, as a forced laborer under the oppressive rule of Khmer Rouge, she discovers that her foster son is none other than Pol Pot. The mass purges of the regime (spanning from 1975 to 1979 - Pol Pot annihilated 25% of Cambodia's population) are intertwined with painful memories of the relatives of the bloodthirsty dictator, who today stage an impressive dance performance depicting an encounter between the leader of the Khmer Rouge and his foster mother. In this stunning documentary, valuable archival material is seamlessly combined with the images of the dancers, the traditional costumes, and the descriptions of the deep significance behind this major cultural expression of the Cambodian people, offering a flawless outcome, one that is profoundly melancholic, beautiful, and yet at the same time tragic. Art serves as pain relief for the greatest open wounds of History."
499. Africa Star,"Africa Star follows three generations of Cypriot women - mother, daughter, and granddaughter - whose lives were tragically altered by one man's submission to temptation. Plagued by guilt over his act in 1945 and his failure to make amends in 1967, the now ailing octogenarian makes one last attempt in 2008."
500. La machine à écrire et autres sources de tracas,"The final installment of the triptych initiated by Nicolas Philibert with On the Adamant (Golden Bear at the 2023 Berlin Film Festival) and followed by At Averroes and Rosa Parks - and likely the most intimate and moving of the three - continues its deep dive into the psychiatric center of Paris. This time, the filmmaker follows resourceful caregivers as they assist patients suddenly faced with a domestic issue - a broken appliance. Behind the camera, while remaining very present, Philibert allows events to unfold naturally, as he skillfully does. Through all these objects that are repaired, it is ultimately the people and their souls that are healed. The volunteers pay attention with respect, patience, and genuine interest in everyone's stories, needs, and worries. And they are filmed with similar care and attention. The film offers time and space for meandering conversations, internal monologues spoken out loud, unexpected guests, musical interludes, and long silences. A warm portrait and plea for compassion."
501. Avant il n'y avait rien,"A Swiss filmmaker of Palestinian origin travels to the West Bank to make sense of the break-up with a childhood friend who became a Jewish settler. While trying to understand why their friendship has not held up in the face of the political situation, he reveals his own tragic family history in Palestine. An emotional exploration of friendship and identity, through the brutality of the occupation and a cry for the survival of Palestinian culture."
502. Snakeeater,An unstable private investigator suddenly awakens on a subway train to find himself plunging deeper and deeper into a nightmare...that may very well be of his own making.
503. The Escapee 2: The Woman in Black,After criminals break out of jail they have their sights set on a job to terminate Casey Roberts once and for all. Accompanied by the Woman in Black.
504. Joshua: Imai Pol Kaka,A bodyguard who has to look after and protect a high-profile woman who comes to Chennai from London.
505. Tack,"The Olympian who pioneered Greece's MeToo movement inspires a younger athlete to break her own silence. In a milestone trial, Sofia stands with Amalia, who is seeking justice for the abuse she endured by her coach when she was a child."
506. Yasmeen's Element,"After losing her homework in the winding paths of her mountain town, resourceful Yasmeen sets off alone on an unexpected journey to find her Professor."
507. Intent Unknown,"In this gripping psychological thriller, four ambitious psychology students embark on a risky experiment to unravel the mysteries of human behavior. Harper choosing her secluded home as the perfect location, she and her classmates Luna, Chase, and Amelia invite Harold a stranger to participate, setting off a chain of events that will forever alter their lives. From TNG FILMS comes a captivating exploration of human nature, choice, and the consequences that arise when boundaries are pushed. Prepare for a cinematic journey into the depths of the mind, where sanity and morality hang in the balance."
508. Sirrini Biliyorum,
509. El salto,"Ibrahim has a home, partner, Mariama, and work in Madrid. Suddenly he reckons the only way back is to jump the fence from Morocco into Spanish protectorate Melilla, a challenging physical feat"
510. Por tus muertos,"A highly commercially successful rock band mysteriously disbanded before their first concert. 30 years later, they have a second chance."
511. Album de Familia,
512. Straight Through Crew,"A contemporary tale about rural hedonism - It's Christmas Eve and a group of friends prepare to attend a village rave. However, dynamics are challenged when substances and feelings collide."
513. The Deceitful Wife,"A recently widowed husband dives into the world of online dating, hoping to find love again. However, his journey takes an unforeseen and nightmarish turn, leading him down a path he never anticipated."
514. Lineman,"In Chandakavadi village, Nata, a lineman, refuses to provide power for a celebration honoring midwife Shardamma's 100th birthday."
515. Hundswut,"It is a 1932 Bavarian tale of fear and accusation. When four teenagers are murdered, a hermit is arrested and violence escalates. Can the women of the village stop the madness?"
516. Murdaritaville,"A group of trop-rock fanatics on their way to an impersonator contest start getting killed off by a half-man, half-bird."
517. Alibaba Aani Chalishitale Chor,"When a group of friends gathers at regular weekend party. But, lights go out briefly on one such occasion, and the group hears a sound of a kiss followed by someone getting slapped."
518. Gump - Jsme dvojka,"Looking for a new owner, dog Gump must leave home. During his journey, he reunites with his sister and needs all his courage and intelligence to save her from terrible monsters."
519. 48 Hours and 1 Minute,"When the 48-hour-law prevents police to search for an abducted child, a resilient mother is forced to hunt through the perilous streets of Belgrade, despite the effects of her psychiatric medication."
520. The Trouble with Mr Doodle,A young boy has doodled obsessively since he first held a pen. His compulsion intensifies until his home and mind are dominated by endless drawings.
521. Salam,"In a refugee camp in the heart of the Sahara desert, a group of young filmmakers carries out a battle against oblivion."
522. Yao Shen Ling,"Thousands of years ago, the immortals and demons fought each other, and the demon king ""Bai Ze"" was defeated. His body was destroyed but his soul was not destroyed. Thousands of years later, the demon king's soul sealed in the fragments of the Qingluan Mirror is about to awaken. For the sake of the people of the world, Mu Qing, a disciple of the immortal world, went to the demon world to find the fragments of the Qingluan Mirror."
523. Los De La Culpa,"Un grupo de comediantes que está atravesando una crisis laboral decide asistir a una misteriosa fiesta, la cual se sale de control, pues termina en un asesinato. ¿Será que ellos son culpables?"
524. Punish Evil,"While maintaining public order, Police Captain Chang Yong discovers a gang of criminals who have robbed a large sum of cash and hidden it within the city. As the investigation into this robbery deepens, many new leads gradually emerge. In the end, with the unwavering efforts of Captain Chang Yong and the entire criminal investigation team, who fear no hardships or dangers, the criminal plot is finally thwarted, and the wrongdoers are brought to justice."
525. Kingdom Reign,"Set amidst the crack epidemic of the 1980s, the narrative delves into themes of betrayal and legacy as a former Marine is forced to inherit a drug empire his father built."
526. The Pilgrimage of Gilbert and George,"Gilbert and George have been on an art pilgrimage for six decades - their life is their art. As it and they enter a whole new period, they reflect on their shared commitment to art both behind them and, they assert, still ahead of them."
527. Alison,"Alison, a young university student facing a challenging life, must fight for her friends and her freedom."
528. El hombre bueno,"Vera, Juan and their daughter Manuela travel to Mallorca to spend a few days in an idyllic house facing the sea owned by Alonso, Juan's former co-worker who, after losing his partner, decided to retire from the world."
529. 1K,"Two young men, down on their luck, are unexpectedly bound by a Lagos bus conductors prank. With just 1 thousand naira, they navigate each other's worlds, forging an unlikely bond amid danger and drama."
530. Vadda Ghar,"Two brothers' lives intertwine with dual love stories, Baani and Jasvir, Deepa and Kelly while their parents Samrath and Sukhwinder manage family life. A tale of love and bonds showing home's true meaning."
531. Eden.,A family that operates one of California's most historic wineries struggles with succession in this hauntingly beautiful mediation on balancing personal and professional identities.
532. A Most Atrocious Thing,A weekend getaway becomes deadly when bad blood turns a group of friends against each other.
533. Nalla Perai Vaanga Vendum Pillaigale,"A carefree youngster from a small town meets an assertive girl on a bike ride. What happens when true intentions are revealed? Will the trip change their lives better, good or worse?"
534. Amigo Garage,Rudra an adolescent boy has always been fascinated by Amigo Garage. His life takes a turn when he enters Amigo Garage and meets Anand.
535. Battle of Varchasva,"Dhanbad means coal, mafia and battle of supremacy. Before independence, Dhanbad has been a bloody battle of supremacy. Amresh Singh, who ruled for the last 20 years, also knows how to earn power along with money. He is the MLA of Dhanbad. Ajay, an honest and hard working worker, raises his voice against atrocities against workers and women by mafia gangster. In view of Ajay's increasing supremacy among the workers, Amresh Singh makes him head of his coal mine. Ajay's increasing domination and Amresh Singh are sure to clash. Young Ajay is a hero of poor and needy people, so in the media he has given images of a domineering don. Ajay's son is against his father's values. In this battle of supremacy, Amresh Singh and Ajay are face to face and the relationship of father and son is also at stake."
536. Ya Boy Kongming! Road to Summer Sonia,"The music industry becomes a battlefield when ancient strategist Kongming is transported from historical China to modern Japan. He'll use military tactics to turn his new friend Eiko into a music star, and together they'll take the party hotspot of Shibuya by storm."
537. The Stimming Pool,Created by a collective of neurodivergent filmmakers in an attempt to provide an alternative and artistic take on what it's like to live with neurodivergence in a chaotic world not made for those who are different.
538. We Can Be Heroes,"A group of teens find belonging at a LARP camp, building a fantasy world facing climate disaster. Through roleplaying heroes facing apocalypse, they find strength to heal past trauma and emerge empowered in life."
539. Jajabara 2.0,"When two strangers meet by a fluke they open up about their criminal past. While one retains the crime, the other seeks redemption."
540. Apaixonada,"Apaixonada, a book by Cris Souza Fontes, follows a woman who faces an identity crisis and embarks on a journey of self-discovery."
541. The Red Files,"Based on the true event of Bantala Rape Case that shook the socio-political notions of 90' West Bengal, Kingshuk Dey Directed film The Red Files deals with the story in two separate timeline, one strictly follows the events occurred in the 90s and other follows the life and endeavours of IPS officer Priti Rao, in the present days. Priti along with Anjan, Imraan, Taniqsha, Arka and Others aid tries to re-open the 1990s Bantala Rape Case File, as in the past with political aid and ardent bureaucratic support and of their lawyer Sohini, the rapists got free, and the three rape victims got no justice in the other hand. Each and every case has its own file. Sometimes these files remain unsolved for several reasons. They stay hidden and isolated from the people and its nation. Such hidden and confidential files are called the red files. The Bantala Rape Case File is no exception indeed. This issue which took place in 1990, three women were brutally raped and murdered. Yet, due to an inadequate amount of proof, political pressure and bureaucratic pressure this file also remained suppressed for years and turned into a red file. Priti focuses on re-opening the case to summon proper punishment to the brutal rapists, still existing in the present days without any fear and Shane. Will she and her team be able to bring justice to the rape victims after so many years? The Red Files will depict the rest with much thrill and enthusiasm."
542. Two's a Crowd in Orlando,"João is about to visit the Universal parks in Orlando, but his boss asks him to hand over her son, Carlos Alberto, to his father in the United States. When the father doesn't show up, João and Carlos Alberto are forced to stay together."
543. Earlybird,"A desperate artistic director aims to revive his struggling theater with off-the-wall stage productions, all the while losing sight of why he chose this life in the first place."
544. Karataka Dhamanaka,A jailer sends two fraudsters to his village to convince and get his adamant father to the city. But the frauds do something extraordinary than the task.
545. Miss Merkel - Ein Uckermark-Krimi 2,"""Miss Merkel - Ein Uckermark-Krimi 2"" is a crime comedy feature film on RTL Deutschland. It's the second part of Miss Merkel - Ein Uckermark-Krimi (2023)."
546. Our Father Wears a Sun,"After actor Søren Spanning's stroke in 2014, his children document their family's adaptation over six years, navigating their evolving relationship and coping with grief until his death in 2020."
547. Ice Cross: Life on the Edge,A documentary that not only unveils the thrilling world of Ice Cross but also sheds light on the sacrifices made by athletes for the love of their sport.
"548. Marisol, llámame Pepa","Documentary on the life of iconic Spanish recording/model/film super-star, Marisol. Her career as Pepa Flores was restarted once she broke free from her perceived ""child star"" Franco era image."
549. The Restoration,Marcia wakes up one day with the unnerving feeling that her husband has disappeared. She decides to take matters into her own hands to find out his whereabouts.
550. Rising Up,"In a world dealing with a changing climate and a degrading ocean, particularly impacting young people, 23-year-old young Australian change maker, United Nations delegate and Take 3 For the Sea ambassador Kal Glanznig goes on a journey across the world to uncover the untold stories of hope and solutions to the climate and ocean plastic crisis. With a strong optimistic outlook, viewers will feel inspired and empowered by how they can rise up, conquer their internal doubts and take action."
551. Unclickable,"A former tech executive gathers a team of software developers in the basement of an undisclosed location. They set out to build a digital advertising fraud operation. Within 12 weeks, they defraud a large number of high-profile advertisers, including the Trump campaign and a series of pro-Biden organizations during the 2020 US Presidential election. As the operation unfolds, we follow interviews about digital advertising, the Google-Facebook duopoly, and the known and lesser-known victims of ad fraud, like Uber and street vendor Nomfundo from South Africa. We also get to address the impact of ad fraud on the internet economy and our societies - and ask: is ad tech destroying democracy?"
552. Idi Minnal Kadhal,The story is spun with guilt and repentance of the characters and unknowingly they undo the wrong that they all had done against each other in the aftermath of an accident. They all realize that rarer action is in virtue than vengeance.
553. Dory Previn: On My Way to Where,"A child tap dancer in New Jersey, Previn went on to write classic songs. In NYC as a showgirl, she wrote for Frank Sinatra and Judy Garland. Caught in a 1960s Hollywood scandal, she entered the Laurel Canyon music scene."
554. La fonte des glaces,"Louise Denoncourt, a parole officer unlike any other, deftly operates an experimental rehabilitation wing for murderers. A new inmate in her care is suspected of killing her mother. Riddled with doubt, Louise embarks on a mission that quickly goes beyond her. How far will she go to prevent him from killing again?"
555. La zona vacía,"Luis is an astrophysicist with a seemingly normal life with his partner, who sees his reality shaken by the arrival of his new neighbors and his daughter Iris."
556. Bullet,"Gautam, a thief, joins the police commissioner's Operation to dismantle a drug mafia gang. He falls for Varsha, a model against his activities, leading him to reform and eventually take down the mafia, winning her heart in the process."
557. Because of Mika,"A quick-witted Long Islander chooses the easy way out in life by selling weed, delivering pizza, and ignoring his past to get by; but business and life soon gets interrupted when he finds a stray dog with one small issue....she's a ghost."
558. We Are Tourists,"While visiting a village in France, Cecile uncovers the darkest and most exciting secrets of the place."
559. Son Sarki: Ahmet'in Türküsü,"In the film, which tells the turning points of Ahmet Kaya's life, it is revealed how Ahmet Kaya influenced people with his art. In addition to his musical career, the film also touches upon Ahmet Kaya's impact on society."
560. Marching in the Dark,"Intent on providing a better life for herself and her children after her farmer-husband's suicide, Sanjivani struggles against her culture's traditional abandonment of widows, until she joins a discussion group with other farmer-suicide widows. Empowered by community, shared stories of resilience, and unexpected solidarity, Sanjivani forges a path forward."
561. Pagpag 24/7,"Haunted by the ghost of a past crime, two friends find themselves stranded with strangers in a convenience store where abandoned souls await their victims."
562. Who?,"This former single mother of two could never imagine one word would change her life forever. Kendra Wright is now a woman scorned, desperate, and determined to find out ""WHO?"" is the culprit of her HIV infection. Her journey starts as soon as she leaves the clinic. When it finally ends, her hidden closet will reveal a pathway full of secrets and forgotten memories, and she'll finally have her question answered, but now she must figure out ""WHAT"" she will do next."
563. Shadows,Six Former Gangsters face retribution from the demonic spirit of a man they once murdered
564. My Little Sister's Wedding,"While rekindling an old flame, a playboy is confronted with his sister's impending marriage. Seeing similarities between himself and his sister's fiancé, he is determined to her her wedding, leading to a path of self-discovery."
565. The MH370 Enigma,"Through interviews with aviation experts, investigators, family members of the passengers, and journalists this documentary meticulously reconstructs the events leading up to the mysterious event. It examines the subsequent search efforts and various theories proposed to explain the disappearance - including mechanical failure, pilot error, hijacking, and conspiracy theories."
566. Raktdhara: The City of Blood,"Raktdhara the city of blood, This story is from Meerut district of U.P where new gangsters come every day. This is the story of two of them, Dharmender and Satender Satte..whose dream is coming in U.P. A Choudhary family of this beach was"
567. Kurban: Budak Iblis,"Bella, Dewi, and Dio move to their ancestral home. Bella's nightmares persist, leading her to uncover a dark secret held by her father, Purnomo, within the house, risking disaster or revelation."
568. Eyes Don't Lie,"Pop star Peetey Weestro struggles with his dark side while climbing the charts with back to back hit records. Realizing that he loves killing just as much as he loves creating music, an inner battle ensues. EYES DONT LIE is the first film of its kind."
569. Gold Boy,Troubles arise after three children accidentally film a murder.
570. Manasa Vacha,"Frustrated by the injustice and hypocrisy of society, few good hearted thieves try to pull the heist of a lifetime to humorous ends."
571. Invisible People,"Invisible People is a multi-layered depiction of the unique Japanese contemporary dance Butoh that flows between revolt, eroticism, trance, prayer, ancestral experience, and physical anonymity."
572. The Heart Stays,A coming of age story about a Native American girl who must choose between personal achievement and the traditional responsibilities of the old ways.
573. Oru Kadha Sollattaa Sir,"Three filmmakers start to write a story, but their writings turn into an awful reality. Spirits become intertwined in their tale with their mysterious past, concluding with Yamma, the King of Hell, making an appearance."
574. Record break,"Ramaiah's janitor Ranga Rao murders him and manipulates his daughter Bharti. After marrying her for wealth and getting her pregnant, Bharti flees to a graveyard where she delivers twins."
575. Stream,"Craven, a streamer with thousands of followers on a live streaming platform, has prepared a very special stream for Halloween."
576. Faders Up: The John Aielli Experience,"John Aielli influenced Austin's musical diversity for over 50 years. The opera singer from Killeen became Austin's legendary voice. His freeform interviews, on-air mishaps and philosophical musings made ""Eklektikos"" a one-of-a-kind show."
577. Amader Divorce,"Fahim, who pledged to love only his wife, never experienced love before marriage. But on their wedding night, his bride's divorce plea shatters his dreams. Will Fahim agree to divorce or seek another path in life?"
578. Byte,A group of college kids try to help their friend when he discovers a mysterious phone app that turns users into werewolves.
579. The Spirit Hunter,
580. Maria Callas,Filmed stage musical about the life of famous opera diva Maria Callas.
581. Fentasy,"The story follows the ambitions of two young individuals hungry for quick wealth. However, their path takes a treacherous turn as they venture into the world of illegal fentanyl production -a dangerous drug with far-reaching consequences."
582. Suishin zero metoru kara,"It's summer vacation, but two high schoolers have been instructed to clean the (empty) swimming pool. As they sweep the pool, they initially discuss school life, love and makeup. But it isn't long before their worries begin to overflow and their thoughts intersect."
583. Follow the Rain,"World famous fungi hunters, a photographer and a filmmaker, invite audiences on a unique expedition into the wilderness of Australia, where the symbiotic dance between fungi, plants and animals, unlocks nature's greatest secrets."
584. Cuadrilátero,Adriana lives a meticulous daily routine with her husband and two children. A new pregnancy upsets this delicate family balance.
585. Eravamo bambini,"In a Carabinieri station in a small town on the Calabrian coast, a marshal interrogates a young and frightened postman, arrested during the night for threatening a patrol carabiniere with a knife."
586. Subway Shark,A reporter goes down into the NYC subway system to investigate the phenomenon of the subway shark.
587. Lewerentz - elämän ja kuoleman arkkitehti,"Swedish architect Sigurd Lewerentz, a master is ahead of his time. Mysterious and reclusive, his legacy is explored through newly discovered recordings, revealing his influence on Nordic architecture and unique blend of styles."
588. Out of Egypt,Follow a group of filmmakers as they attempt the Exodus journey and consider how God can take us all from slavery to salvation.
